{
  "$schema": "https://json-schema.org/draft/2020-12/schema",
  "additionalProperties": false,
  "properties": {
    "computerId": {
      "pattern": "^cmp_[0-9a-hjkmnp-tv-z]{26}$",
      "type": "string"
    },
    "files": {
      "additionalProperties": false,
      "properties": {
        ".claude/.credentials.json": {
          "oneOf": [
            {
              "additionalProperties": false,
              "properties": {
                "contentBase64": {
                  "maxLength": 87384,
                  "pattern": "^(?:[A-Za-z0-9+/]{4})*(?:[A-Za-z0-9+/]{2}==|[A-Za-z0-9+/]{3}=)?$",
                  "type": "string"
                },
                "copyOrder": {
                  "maximum": 9007199254740991,
                  "minimum": 1,
                  "type": "integer"
                },
                "mode": {
                  "maximum": 511,
                  "minimum": 0,
                  "type": "integer"
                },
                "state": {
                  "const": "present",
                  "type": "string"
                }
              },
              "required": [
                "state",
                "mode",
                "copyOrder",
                "contentBase64"
              ],
              "type": "object"
            },
            {
              "additionalProperties": false,
              "properties": {
                "copyOrder": {
                  "maximum": 9007199254740991,
                  "minimum": 1,
                  "type": "integer"
                },
                "state": {
                  "const": "tombstone",
                  "type": "string"
                }
              },
              "required": [
                "state",
                "copyOrder"
              ],
              "type": "object"
            }
          ]
        },
        ".claude/.device-keys.json": {
          "oneOf": [
            {
              "additionalProperties": false,
              "properties": {
                "contentBase64": {
                  "maxLength": 87384,
                  "pattern": "^(?:[A-Za-z0-9+/]{4})*(?:[A-Za-z0-9+/]{2}==|[A-Za-z0-9+/]{3}=)?$",
                  "type": "string"
                },
                "copyOrder": {
                  "maximum": 9007199254740991,
                  "minimum": 1,
                  "type": "integer"
                },
                "mode": {
                  "maximum": 511,
                  "minimum": 0,
                  "type": "integer"
                },
                "state": {
                  "const": "present",
                  "type": "string"
                }
              },
              "required": [
                "state",
                "mode",
                "copyOrder",
                "contentBase64"
              ],
              "type": "object"
            },
            {
              "additionalProperties": false,
              "properties": {
                "copyOrder": {
                  "maximum": 9007199254740991,
                  "minimum": 1,
                  "type": "integer"
                },
                "state": {
                  "const": "tombstone",
                  "type": "string"
                }
              },
              "required": [
                "state",
                "copyOrder"
              ],
              "type": "object"
            }
          ]
        },
        ".codex/.credentials.json": {
          "oneOf": [
            {
              "additionalProperties": false,
              "properties": {
                "contentBase64": {
                  "maxLength": 87384,
                  "pattern": "^(?:[A-Za-z0-9+/]{4})*(?:[A-Za-z0-9+/]{2}==|[A-Za-z0-9+/]{3}=)?$",
                  "type": "string"
                },
                "copyOrder": {
                  "maximum": 9007199254740991,
                  "minimum": 1,
                  "type": "integer"
                },
                "mode": {
                  "maximum": 511,
                  "minimum": 0,
                  "type": "integer"
                },
                "state": {
                  "const": "present",
                  "type": "string"
                }
              },
              "required": [
                "state",
                "mode",
                "copyOrder",
                "contentBase64"
              ],
              "type": "object"
            },
            {
              "additionalProperties": false,
              "properties": {
                "copyOrder": {
                  "maximum": 9007199254740991,
                  "minimum": 1,
                  "type": "integer"
                },
                "state": {
                  "const": "tombstone",
                  "type": "string"
                }
              },
              "required": [
                "state",
                "copyOrder"
              ],
              "type": "object"
            }
          ]
        },
        ".codex/auth.json": {
          "oneOf": [
            {
              "additionalProperties": false,
              "properties": {
                "contentBase64": {
                  "maxLength": 87384,
                  "pattern": "^(?:[A-Za-z0-9+/]{4})*(?:[A-Za-z0-9+/]{2}==|[A-Za-z0-9+/]{3}=)?$",
                  "type": "string"
                },
                "copyOrder": {
                  "maximum": 9007199254740991,
                  "minimum": 1,
                  "type": "integer"
                },
                "mode": {
                  "maximum": 511,
                  "minimum": 0,
                  "type": "integer"
                },
                "state": {
                  "const": "present",
                  "type": "string"
                }
              },
              "required": [
                "state",
                "mode",
                "copyOrder",
                "contentBase64"
              ],
              "type": "object"
            },
            {
              "additionalProperties": false,
              "properties": {
                "copyOrder": {
                  "maximum": 9007199254740991,
                  "minimum": 1,
                  "type": "integer"
                },
                "state": {
                  "const": "tombstone",
                  "type": "string"
                }
              },
              "required": [
                "state",
                "copyOrder"
              ],
              "type": "object"
            }
          ]
        }
      },
      "required": [
        ".claude/.credentials.json",
        ".claude/.device-keys.json",
        ".codex/auth.json",
        ".codex/.credentials.json"
      ],
      "type": "object"
    },
    "formatVersion": {
      "maximum": 9007199254740991,
      "minimum": 1,
      "type": "integer"
    },
    "generation": {
      "maximum": 9007199254740991,
      "minimum": 0,
      "type": "integer"
    },
    "order": {
      "maximum": 9007199254740991,
      "minimum": 1,
      "type": "integer"
    }
  },
  "required": [
    "formatVersion",
    "computerId",
    "generation",
    "order",
    "files"
  ],
  "title": "CredentialBundle",
  "type": "object"
}
