{
  "formatVersion": 1,
  "computerId": "cmp_01hzy3m8k6q4t2v9w7x5r0s1n3",
  "generation": 7,
  "order": 9,
  "files": {
    ".claude/.credentials.json": {
      "state": "present",
      "mode": 384,
      "copyOrder": 4,
      "contentBase64": "eyJzeW50aGV0aWMiOiJub3QgYSBsb2dpbiJ9"
    },
    ".claude/.device-keys.json": {
      "state": "tombstone",
      "copyOrder": 1
    },
    ".codex/auth.json": {
      "state": "present",
      "mode": 384,
      "copyOrder": 5,
      "contentBase64": "eyJzeW50aGV0aWMiOiJub3QgYSBsb2dpbiBlaXRoZXIifQ=="
    },
    ".codex/.credentials.json": {
      "state": "tombstone",
      "copyOrder": 2
    }
  }
}
